{
  "$schema": "https://json-schema.org/draft/2020-12/schema",
  "$id": "https://voltpilot.de/contracts/mqtt-charging-boost.schema.json",
  "title": "Cloud -> Edge Einmal-Uebersteuerung eines Ladevorgangs („Jetzt voll laden“, OCPP-Lastmanagement Stufe 4)",
  "description": "Die Uebersteuerung der UEBERSCHUSS-PRIORITAET fuer GENAU EINEN laufenden Ladevorgang. NICHT-RETAINED, QoS1, auf ems/{tenant_id}/{site_id}/{device_id}/v2/charging-boost - im selben v2/#-Teilbaum, den die per-Geraet-ACL seit D-2 abdeckt (KEINE Broker-Aenderung).\n\nWAS SIE IST: woertlich die Freigabe der :8484-Taste „Jetzt voll laden“ mit anderem TRANSPORT - beide muenden in denselben Kern (Agent.OcppBoost), es gibt also keinen zweiten Weg zum Uebersteuern, den man spaeter getrennt absichern muesste (dieselbe Ein-Kern-Doktrin wie beim OTA-Apply-Pfad).\n\nWAS SIE NICHT IST: eine Grenze. Sie nimmt EINEN Ladevorgang von der QUELLEN-Politik aus, damit er auch Netzstrom ziehen darf. Anschlussgrenze, Sicherheitsabstand, Paragraf-14a-Huelle, Mindestleistung, Vorrang-Rang und das in der Saeule hinterlegte Ausfall-Profil binden ihn danach exakt wie jeden anderen - und die Prioritaet ALLER ANDEREN Ladevorgaenge bleibt unveraendert. Die Uebersteuerung schlaegt die OEKONOMIE, nie die PHYSIK.\n\nWARUM NICHT-RETAINED, und das ist die tragende Entscheidung: eine retained Nachricht wird bei JEDEM Verbindungsaufbau erneut zugestellt. Eine Einmal-Uebersteuerung, die beim naechsten Reconnect wieder erscheint, waere keine - sie wuerde ein Fahrzeug beliebig oft erneut auf Netzstrom setzen.\n\nNICHT-retained allein genuegt aber NICHT: das Geraet haelt eine dauerhafte Sitzung (cleanSession=false), der Broker darf eine QoS1-Nachricht also NACHLIEFERN. Die zweite Haelfte ist deshalb `requested_at`: das Geraet uebernimmt diesen Stempel als Beginn des Fensters, statt den Empfangs-Zeitpunkt zu nehmen - eine nachgelieferte Uebersteuerung ist bei ihrer Ankunft bereits abgelaufen und wird VERWORFEN.\n\nFOLGE FUER EINE OFFLINE-BOX: eine verpasste Uebersteuerung wirkt NICHT mehr. Das ist beabsichtigt - eine Zustimmung von vor drei Stunden ist keine Zustimmung fuer jetzt, und ein Fahrzeug, das inzwischen abgesteckt wurde, darf ihre Wirkung nicht erben.\n\nSIE GILT GENAU EINER SITZUNG: eine neue Sitzung am selben Stecker ist ein anderes Fahrzeug und erbt sie nie (das Geraet bindet sie an die laufende Transaktion). Ohne laufenden Ladevorgang wird sie abgelehnt - eine Zusage ueber ein Fahrzeug, das nicht da ist, waere erfunden.",
  "type": "object",
  "required": [
    "schema_version",
    "tenant_id",
    "site_id",
    "device_id",
    "charge_point_id",
    "connector_id",
    "requested_at"
  ],
  "additionalProperties": false,
  "properties": {
    "schema_version": {
      "const": "1.0",
      "description": "Vertragsversion; ein Geraet, das sie nicht kennt, VERWIRFT die Nachricht (fail-closed) und behaelt die Prioritaet des Kunden."
    },
    "tenant_id": {
      "type": "string",
      "format": "uuid"
    },
    "site_id": {
      "type": "string",
      "format": "uuid"
    },
    "device_id": {
      "type": "string",
      "format": "uuid",
      "description": "Muss der Identitaet des Topics entsprechen - das Geraet prueft das nach und verwirft STUMM (die Regel von Telemetrie/purge_data/Zuweisung/Apply: eine Antwort bestaetigte einem falsch adressierten Absender die Existenz dieses Geraets)."
    },
    "charge_point_id": {
      "type": "string",
      "minLength": 1,
      "maxLength": 64,
      "description": "Die OCPP-ChargePointId der Saeule - DIE Identitaet (herstellerneutral, Konzept Paragraf 0)."
    },
    "connector_id": {
      "type": "integer",
      "minimum": 1,
      "maximum": 64,
      "description": "Der Stecker. Ein Stecker = ein Fahrzeug = ein Anspruch auf das Budget; die Uebersteuerung gilt genau diesem einen."
    },
    "minutes": {
      "type": "integer",
      "minimum": 1,
      "maximum": 240,
      "description": "Wie lange sie gelten soll. ABWESEND = der Deckel von 240 Minuten (4 Stunden) - ausser mit `until_unplug: true`, dann zaehlt `minutes` nicht. Ein groesserer Wunsch wird GEKLEMMT, nie abgelehnt - der Deckel ist eine Zusage, keine Falle. Sie endet ausserdem, sobald die Sitzung endet („bis das Fahrzeug voll ist“)."
    },
    "until_unplug": {
      "type": "boolean",
      "description": "ADDITIV (W-10, Audit vp-ocpp-haushalt-audit): true = „bis Abstecken“ - die Uebersteuerung gilt wirklich bis zum Ende DIESER Sitzung, gleich welcher Richtung; `minutes` wird dann ignoriert. Das Geraet deckelt sie nur noch mit seinem eigenen Deckel fuer diesen Fall (14 Stunden statt 4), der allein eine Sitzung begrenzt, die niemand beendet. Eine Pause (`action: pause`) haelt das Geraet zusaetzlich ueber einen Neustart hinweg, an dieselbe Transaktion gebunden; „Jetzt voll laden“ bleibt bewusst fluechtig (nach einem Neustart gilt wieder die Prioritaet des Kunden).\n\nABWESEND oder false = genau das Verhalten von vorher (`minutes`, abwesend 240). Ein Geraet, das das Feld nicht kennt, ueberliest es und klemmt auf 240 Minuten - die Cloud sendet es deshalb nur, wenn der Kunde „bis Abstecken“ gewaehlt hat."
    },
    "action": {
      "enum": ["voll", "pause"],
      "description": "WAS uebersteuert wird - die zwei Richtungen desselben Mechanismus (Konzept `vp-verbrauchsmgmt-konzept-v1` Paragraf 4.6, Entscheid E5).\n\n`voll` (die Vorgabe): „Jetzt voll laden“ - die Sitzung wird von der QUELLEN-Politik befreit und darf auch Netzstrom ziehen.\n\n`pause`: „Laden pausieren“ - die Sitzung wird auf 0 kW gedeckelt und pausiert mit dem Grund „handeingriff“. Andere Ladevorgaenge sind UNBERUEHRT, und der Deckel ist RESTRICT-ONLY: Anschlussgrenze, Sicherheitsabstand, Paragraf-14a-Huelle, Ausfall-Profil und der Totmann der Saeule binden unveraendert weiter - eine Pause kann keine Grenze weiten.\n\nABWESEND = `voll`. Das ist die Kompatibilitaets-Zusage: eine Cloud, die das Feld nicht sendet, erteilt genau den Boost von vorher, und eine Box, die es nicht kennt, ueberliest es und tut dasselbe.\n\nBEIDE Richtungen sind an DIESELBE Transaktion gebunden und enden beim Abstecken; `cancel` nimmt beide zurueck (die eine Ruecknahme heisst auf jeder Flaeche „Automatik fortsetzen“)."
    },
    "cancel": {
      "type": "boolean",
      "description": "true nimmt eine laufende Uebersteuerung SOFORT zurueck - gleich welcher Richtung (`voll` wie `pause`); danach gilt wieder die Ueberschuss-Prioritaet des Kunden. Eine Ruecknahme wird auch dann angenommen, wenn gerade nichts laeuft (idempotent)."
    },
    "requested_at": {
      "type": "string",
      "format": "date-time",
      "description": "Wann die Cloud die Uebersteuerung erteilt hat. DAS GERAET UEBERNIMMT DIESEN STEMPEL als Beginn seines Fensters (siehe oben) - eine nachgelieferte Nachricht ist damit bei ihrer Ankunft abgelaufen. Ein unlesbarer Stempel gilt gar nicht."
    },
    "actor": {
      "type": "string",
      "maxLength": 128,
      "description": "Wer sie erteilt hat (JWT-Subject) - nur fuer die Papier-Spur, das Geraet entscheidet daran nichts."
    }
  }
}
