{
  "schema_version": "1.0",
  "tenant_id": "00000000-0000-0000-0000-000000000001",
  "site_id": "00000000-0000-0000-0000-000000000002",
  "device_id": "00000000-0000-0000-0000-000000000003",
  "charge_point_id": "saeule-1",
  "connector_id": 1,
  "cancel": true,
  "requested_at": "2026-08-20T13:31:00Z"
}
